{
  "id": "evt-1938-jan",
  "slug": "1938-january-great-aurora",
  "name": "January 1938 Great Aurora Storm",
  "altNames": [
    "January 1938 Storm",
    "1938 Great Geomagnetic Storm",
    "The Fatima Storm",
    "1938 January Great Aurora Storm"
  ],
  "startDate": "1938-01-25",
  "peakDate": "1938-01-25",
  "endDate": "1938-01-26",
  "durationHours": 48,
  "phenomena": [
    {
      "type": "geomag_storm",
      "subtype": "G5",
      "details": "Intense geomagnetic storm (the great low-latitude aurora of January 25-26); Dcx/Dst estimated at approximately −336 nT (Hayakawa et al. 2021)."
    }
  ],
  "noaaGScale": 5,
  "noaaSScale": null,
  "noaaRScale": null,
  "peakDst": -336,
  "peakKp": 9,
  "peakAp": null,
  "peakAE": null,
  "flareClass": null,
  "cmeSpeedKmS": null,
  "solarWindSpeedPeak": null,
  "bzMin": null,
  "protonFluxPeak": null,
  "solarCycleNumber": 17,
  "cyclePhase": "descending",
  "sourceActiveRegion": null,
  "sunspotNumberDaily": null,
  "impacts": [
    {
      "sector": "aurora",
      "location": "Global",
      "description": "Spectacular aurora visible worldwide at very low latitudes, widely reported in newspapers across Europe, North America, and Asia.",
      "severity": "extreme"
    },
    {
      "sector": "communications",
      "location": "Global",
      "description": "Radio communication blackouts and telegraph disruptions reported across multiple continents; long-distance radio links particularly affected.",
      "severity": "severe"
    },
    {
      "sector": "cultural",
      "location": "Europe",
      "description": "The intense red glow was widely mistaken for fires: fire brigades were called out in several cities (including around London and in Austria) to blazes that turned out to be the aurora, and the New York Times of 26 January 1938 ran 'Aurora Borealis Startles Europe; People Flee in Fear, Call Firemen.' Some Roman Catholics identify the display with the 'night illumined by an unknown light' foretold in the Second Secret of Fatima, and it is popularly remembered as the 'Fatima Storm' - a cultural interpretation, not a scientific claim.",
      "severity": "minor"
    }
  ],
  "auroraLowestLatitude": 28,
  "timeSeries": [],
  "images": [],
  "papers": [
    {
      "doi": "10.3847/1538-4357/abc427",
      "title": "The Intensity and Evolution of the Extreme Solar and Geomagnetic Storms in 1938 January",
      "authors": "Hayakawa, H., Hattori, K., Pevtsov, A. A., et al.",
      "year": 2021,
      "journal": "The Astrophysical Journal",
      "keyFinding": "Reconstructed the January 1938 storm sequence from magnetograms and auroral reports, estimating a minimum Dst of about −336 nT and an auroral oval reaching unusually low latitudes."
    }
  ],
  "summary": "The January 1938 great aurora storm produced one of the most spectacular worldwide aurora displays of the 20th century, with aurora visible at magnetic latitudes below 30° during an intense geomagnetic storm (Dst ~ −336 nT) just after Solar Cycle 17 maximum.",
  "description": "On January 25–26, 1938, a powerful geomagnetic storm struck Earth during the descending phase of Solar Cycle 17 (which peaked in 1937). The storm produced an estimated Dst of approximately −336 nT (Hayakawa et al. 2021) and drove aurora visible at remarkably low latitudes across both hemispheres. (A smaller storm had occurred earlier in the month around January 16–17.) Newspaper reports from across Europe, North America, and Asia described vivid red and green aurora. The intense red glow was widely mistaken for distant fires, prompting calls to fire brigades in several European cities - the New York Times of 26 January 1938 ran 'Aurora Borealis Startles Europe; People Flee in Fear, Call Firemen.' Radio communications were severely disrupted, and telegraph systems experienced interference. Occurring just before the outbreak of World War II, the storm is culturally remembered by some Roman Catholics as the 'night illumined by an unknown light' foretold in the Second Secret of Fatima - hence its popular name, the 'Fatima Storm' - a religious interpretation rather than a scientific claim.",
  "estimatedFields": [
    "peakDst"
  ]
}
