{
  "id": "evt-1582-aurora",
  "slug": "1582-great-aurora",
  "name": "1582 Great Aurora",
  "altNames": [
    "March 1582 Aurora",
    "1582 Red Aurora Event"
  ],
  "startDate": "1582-03-08",
  "peakDate": "1582-03-08",
  "endDate": "1582-03-10",
  "durationHours": 48,
  "phenomena": [
    {
      "type": "geomag_storm",
      "subtype": "Extreme",
      "details": "Inferred extreme geomagnetic storm from widespread aurora reports across Europe and East Asia at low magnetic latitudes."
    }
  ],
  "noaaGScale": 5,
  "noaaSScale": null,
  "noaaRScale": null,
  "peakDst": null,
  "peakKp": null,
  "peakAp": null,
  "peakAE": null,
  "flareClass": null,
  "cmeSpeedKmS": null,
  "solarWindSpeedPeak": null,
  "bzMin": null,
  "protonFluxPeak": null,
  "solarCycleNumber": null,
  "cyclePhase": "unknown",
  "sourceActiveRegion": null,
  "sunspotNumberDaily": null,
  "impacts": [
    {
      "sector": "aurora",
      "location": "Europe, Japan, China, Korea",
      "description": "Extraordinary red aurora observed across Europe (Portugal, Spain, Germany, Flanders) and independently in Japan, China, and Korea, indicating visibility at magnetic latitudes below 30°.",
      "severity": "extreme"
    },
    {
      "sector": "cultural",
      "location": "Europe, East Asia",
      "description": "Extensively documented in European chronicles and East Asian court records; described as 'fire in the sky' and 'blood-red clouds', often interpreted as divine omens.",
      "severity": "moderate"
    }
  ],
  "auroraLowestLatitude": 28,
  "timeSeries": [],
  "images": [],
  "papers": [
    {
      "doi": "10.1093/mnras/stz1401",
      "title": "Occurrence of great magnetic storms on 6–8 March 1582",
      "authors": "Hattori, K., Hayakawa, H., Ebihara, Y.",
      "year": 2019,
      "journal": "Monthly Notices of the Royal Astronomical Society",
      "keyFinding": "Compiled European and East Asian records of the March 1582 aurorae and reconstructed the equatorward extent of the auroral oval, showing a sequence of great magnetic storms on 6–8 March 1582."
    },
    {
      "doi": "10.1051/swsc/2020005",
      "title": "Portuguese eyewitness accounts of the great space weather event of 1582",
      "authors": "Sánchez Carrasco, V. M., Vaquero, J. M.",
      "year": 2020,
      "journal": "Journal of Space Weather and Space Climate",
      "keyFinding": "Presented Portuguese eyewitness accounts of the 1582 display, extending its documented low-latitude visibility in Europe."
    }
  ],
  "summary": "A major geomagnetic storm on March 8, 1582 produced spectacular red aurora observed simultaneously across Europe and East Asia, with visibility at magnetic latitudes below 30°, making it one of the most extreme pre-instrumental space weather events.",
  "description": "Historical records from Portugal, Spain, Germany, Flanders, Japan, China, and Korea describe a vivid red aurora on March 8, 1582 that lasted at least two nights. European observers noted 'fire in the heavens' and 'blood-red vapors', while East Asian court records documented similar phenomena. The simultaneous observation across two continents at low magnetic latitudes confirms the event's extreme intensity, placing it among the strongest known historical geomagnetic storms. Hayakawa et al. (2020) compiled and cross-referenced these records, demonstrating that pre-telescopic era observations can provide valuable constraints on the occurrence rate of extreme space weather events.",
  "estimatedFields": [
    "noaaGScale"
  ]
}
